{
  "$schema": "https://json-schema.org/draft/2020-12/schema",
  "$id": "paf.design-system.schema.json",
  "title": "PAF Design System / Theming Contract (Step 23)",
  "description": "Enforces data-driven theming: visual look-and-feel is swappable via tokens without touching structure, and feature logic never lives in the theme layer.",
  "type": "object",
  "required": ["header", "tokenLayer", "themeLayer", "structuralLayer", "layerSeparationRule", "sharedControlRegistry", "baselineRule", "accessibilityRequirements", "visualRegressionRule"],
  "properties": {
    "header": { "$ref": "paf.common.schema.json#/$defs/artifactHeader" },
    "tokenLayer": {
      "type": "object",
      "required": ["tokenClasses", "rule"],
      "properties": {
        "tokenClasses": { "type": "array", "items": { "enum": ["COLOR", "TYPOGRAPHY", "SPACING", "RADIUS", "ELEVATION", "MOTION", "ICONOGRAPHY"] } },
        "rule": { "const": "Tokens carry appearance values only. A token may never encode a business rule, threshold, or feature condition." }
      },
      "additionalProperties": false
    },
    "themeLayer": {
      "type": "object",
      "required": ["rule"],
      "properties": { "rule": { "const": "A theme is a named set of token values. Swapping a theme changes appearance only; it never changes what a component does or which data it shows." } },
      "additionalProperties": false
    },
    "structuralLayer": {
      "type": "object",
      "required": ["rule"],
      "properties": { "rule": { "const": "Component structure, behavior, and data binding are independent of the active theme and are never generated from theme content." } },
      "additionalProperties": false
    },
    "layerSeparationRule": {
      "const": "No magic numbers in the render layer: colors, bands, thresholds, and formats arrive via spec or token, never hardcoded (chart ground rule 11)."
    },
    "sharedControlRegistry": {
      "type": "array",
      "items": {
        "type": "object",
        "required": ["controlId", "status", "protected"],
        "properties": {
          "controlId": { "type": "string" },
          "status": { "enum": ["ACTIVE", "DEPRECATED"] },
          "protected": { "const": true }
        },
        "additionalProperties": false
      }
    },
    "baselineRule": {
      "const": "Every shared control and screen has an approved visual baseline. A rendered difference from baseline is a defect unless the baseline itself is changed through a governed workflow."
    },
    "accessibilityRequirements": {
      "type": "array", "minItems": 1,
      "items": {
        "type": "object",
        "required": ["requirement", "rule"],
        "properties": { "requirement": { "type": "string" }, "rule": { "type": "string" } },
        "additionalProperties": false
      }
    },
    "responsiveMatrix": {
      "type": "array",
      "items": { "type": "object", "required": ["breakpointId"], "properties": { "breakpointId": { "type": "string" }, "minWidth": { "type": "integer" } }, "additionalProperties": false }
    },
    "visualRegressionRule": {
      "const": "Visual regression evidence is DETERMINISTIC: same input yields identical pixels, stable sort and category order, no random jitter (chart ground rule 10)."
    }
  },
  "additionalProperties": false
}
